{
  "$schema": "https://condenser-team.github.io/condenser-registry/schema/plugins",
  "@context": "https://schema.org/",
  "@type": "SoftwareApplication",
  "@id": "https://condenser-team.github.io/condenser-registry/plugins/example-plugin",
  "name": "Example Plugin",
  "description": "Demo plugin demonstrating all Condenser surfaces: Tab, Panel, Page, Persistent, Toast, Modal, and Context Menu.",
  "applicationCategory": "adventure",
  "keywords": [
    "example"
  ],
  "author": {
    "@id": "https://condenser-team.github.io/condenser-registry/authors/condenser-team",
    "@type": "Organization",
    "name": "Condenser Team"
  },
  "url": "https://condenser-team.github.io/condenser-registry/plugins/example-plugin",
  "image": "https://condenser-team.github.io/condenser-registry/plugins/example-plugin/index.jpg",
  "versions": [
    {
      "@id": "https://condenser-team.github.io/condenser-registry/plugins/example-plugin/versions/1.0.0",
      "@type": "SoftwareApplication",
      "name": "Example Plugin 1.0.0"
    }
  ],
  "latestVersion": {
    "@id": "https://condenser-team.github.io/condenser-registry/plugins/example-plugin/versions/1.0.0",
    "@type": "SoftwareApplication",
    "name": "Example Plugin 1.0.0"
  }
}